"Age of Ultron","A2-28T","Der Zug kommt auf einer koreanischen Straße zum Stehen.","Longcross Studios, Chobham Lane, Chertsey, England KT16 0EX, United Kingdom","Die letzten Aufnahmen des Zuges wurden laut Cinefex #142 im Backlot der Longcross-Studios in England gedreht.","51.3832677947837","-0.5936927730749278","Seoul, Südkorea","37.52975100584142","127.06706699827458",01:26:13,2015,"Clint Barton als Hawkeye / Steve Rogers als Captain America / Natascha Romanow als Black Widow / Ultron",,"https://mculocationscout.com/2020/08/09/train-chase-seoul-mcu-location-scout/",
"Age of Ultron","A2-29","Hawkeye ist zurück im Stark Tower, wo er noch immer besorgt um Black Widow, mit Tony Stark und Bruce Banner spricht. Tony plant JARVIS mithilfe von Banner in den Zepter zu bringen.","Shepperton Studios, Studios Road, Shepperton, Surrey, England, UK","Hierbei handelt es sich um Studioaufnahmen.","51.40797670356879","-0.46609220136945423","Stark Turm (innen)","40.75344630782818","-73.9766453444253",01:27:09,2015,"Clint Barton als Hawkeye / Tony Stark als Tony Stark als Iron Man / Bruce Banner",,,
"Age of Ultron","A2-30","Black Widow wacht in Ultrons Versteck in Sokovia auf.","Shepperton Studios, Studios Road, Shepperton, Surrey, England, UK","Hierbei handelt es sich um Studioaufnahmen.","51.40797670356879","-0.46609220136945423","Sokovia","null","null",01:29:19,2015,"Natascha Romanow als Black Widow / Ultron",,,
"Age of Ultron","A2-31","Tony Stark lädt heimlich JARVIS - der nach seinem Versteck vor Ultron tief im Internet immer noch funktionsfähig ist - in den künstlichen Körper. Währenddessen erhält Hawkeye Morsecode von Black Widows Aufenthalt in Ultrons Versteck in Sokovia.","Shepperton Studios, Studios Road, Shepperton, Surrey, England, UK","Hierbei handelt es sich um Studioaufnahmen.","51.40797670356879","-0.46609220136945423","Stark Turm (innen)","40.75344630782818","-73.9766453444253",01:30:31,2015,"Tony Stark / Bruce Banner",,,
"Age of Ultron","A2-32","Captain America und die Zwillinge wollen Stark von seinem Vorgehen, JARVIS in einen künstlichen Körper hochzuladen abhalten. Es endet in einem Kampf. Thor erweckt den Androide, Vision genannt, vollständig zum Leben. Er schließt sich dem Kampf gegen Ultro","Shepperton Studios, Studios Road, Shepperton, Surrey, England, UK","Hierbei handelt es sich um Studioaufnahmen.","51.40797670356879","-0.46609220136945423","Stark Turm (innen)","40.75344630782818","-73.9766453444253",01:31:20,2015,"Tony Stark / Bruce Banner / Steve Rogers als Captain America / Pietro Maximoff als Quicksilver / Wanda Maximoff als Scarlet Witch / Thor / Vision",,"https://de.wikipedia.org/wiki/Avengers:_Age_of_Ultron",
"Age of Ultron","A2-33","Das Quinjet fliegt nach Sokovia.","Aosta Valley, Italy","Die Burg Fort Bard in Italien wird für die Außenaufnahmen verwendet.","45.608475766257","7.744776327306901","Hydra Basis (außen)","null","null",01:37:35,2015,,,,
"Age of Ultron","A2-34","Als sich Ultrons Truppen in Novi Grad versammeln, beginnen Hawkeye und Scarlet mit der Evakuierung der Bürger. In einer Wohnung wird eine Familie durch die Kräfte von Scarlet evakuiert.","Via Caduti della Libertà, 6, 11029 Verrès AO, Italy","Der Blick aus dem Fenster geht nach Nordosten auf eine Gasse mit Le Petit Cafe Bar Gelateria.","45.66864773951658","7.69153390171248","Sokovia","null","null",01:37:55,2015,"Wanda Maximoff als Scarlet Witch",,"https://mculocationscout.com/2020/08/09/pedestrian-bridge-novi-grad-mcu-location-scout/",
"Age of Ultron","A2-35","Hawkeye sitzt auf einem Dach und überwacht die Evakuierung.","Via Caduti della Libertà, 3, 11029 Verrès AO, Italy","Gedreht wurde über der Via Caduti della Liberta.","45.66878698581386","7.691483701495474","Sokovia","null","null",01:38:13,2015,"Clint Barton als Hawkeye",,,
"Age of Ultron","A2-36","Die Stadtbewohner evakuieren die Zerstörung zwischen Ultrons Armee und den Avengers.","Via Roma, 11026 Pont-Saint-Martin AO, Italy","Sie überqueren die Ponte Del Diavolo an der Via Roma in Pont-Saint-Martin, Italien.","45.599306734773364","7.800140835365246","Sokovia","null","null",01:38:35,2015,,,,
"Age of Ultron","A2-37","Bruce Banner befreit Black Widow aus dem Gefängnis","Shepperton Studios, Studios Road, Shepperton, Surrey, England, UK","Hierbei handelt es sich um Studioaufnahmen.","51.40797670356879","-0.46609220136945423","Ultrons Versteck","null","null",01:38:40,2015,"Natascha Romanow als Black Widow / Bruce Banner",,,
"Age of Ultron","A2-38","Hawkeye und Scarlet bekämpfen Droiden auf einer Brücke.","Via Martorey, 3, 11029 Verrès AO, Italy","Gedreht auf der Brücke Via Caduti della Liberta in Verrès, Italien.","45.66846404603949","7.6921397269641165","Sokovia","null","null",01:40:25,2015,"Clint Barton als Hawkeye / Wanda Maximoff als Scarlet Witch",,,
"Age of Ultron","A2-39","Ultron und Vision treffen in der Kirche aufeinander.","Shepperton Studios, Studios Road, Shepperton, Surrey, England, UK","Hierbei handelt es sich um Studioaufnahmen.","51.40797670356879","-0.46609220136945423","Kirche, Sokovia","null","null",01:40:56,2015,"Ultron / Vision",,,
"Age of Ultron","A2-40A","Quicksilver wehrt Droiden ab, die in Autos einschlagen.","Piazza Plouves
11100 Aosta AO
Italy","Die Aufnahmen fanden auf dem Parkplatz der Piazza Plouves in Aosta, Italien, statt.","45.737108464477586","7.323415024805015","Sokovia","null","null",01:41:20,2015,"Pietro Maximoff als Quicksilver",,"https://mculocationscout.com/2020/08/09/battle-of-sokovia-italy-mcu-location-scout/",
"Age of Ultron","A2-40B","Quicksilver macht einen Halt vor einer verfallenen Steinmauer.","17 Via Vevey
Aosta, Aostatal","Die Steinmauer ist in der Via Torino in Aosta, Italien.","45.73676028787767","7.324677000172748","Sokovia","null","null",01:41:18,2015,"Pietro Maximoff als Quicksilver",,"https://mculocationscout.com/2020/08/09/battle-of-sokovia-italy-mcu-location-scout/",
"Age of Ultron","A2-41","Thor kämpft sich hinunter in Ultrons unterirdisches Versteck","Shepperton Studios, Studios Road, Shepperton, Surrey, England, UK","Hierbei handelt es sich um Studioaufnahmen.","51.40797670356879","-0.46609220136945423","Ultrons Versteck","null","null",01:41:48,2015,"Thor",,,
"Age of Ultron","A2-42","Die Stadt erhebt sich in die Höhe. Brücken bersten auseinander.","Shepperton Studios, Studios Road, Shepperton, Surrey, England, UK","Hierbei handelt es sich um Studioaufnahmen.","51.40797670356879","-0.46609220136945423","Sokovia","null","null",01:42:02,2015,"Steve Rogers als Captain America / Wanda Maximoff als Scarlet Witch / Clint Barton als Hawkeye / Thor",,"https://mculocationscout.com/2020/08/09/novi-grad-square-sokovia-mcu-location-scout/",
"Age of Ultron","A2-43","The Hulk und Black Widow landen im Wald.","Bourne Woods, Tilford Rd, Farnham, England GU10 3RW, United Kingdom","Der Bourne-Wald wurde für die Aufnahmen verwendet.","51.19289380732606","-0.7711367791992004","Sokovischer Wald","null","null",01:43:57,2015,"Natascha Romanow als Black Widow / Bruce Banner als Hulk",,"https://mculocationscout.com/2020/08/09/sokovian-woods-mcu-location-scout/",
"Age of Ultron","A2-44","Auf dem Novi Grad Square liefern sich Ultrons Droiden und die Avengers den finalen Kampf.","Lismore Blv, London, United Kingdom","Gedreht wurde im Metropolitan Police Training Centre am Lismore Blv. Auf einer Seite des Ausbildungszentrums stand eine Statue von Sir Robert Peele, die nicht bewegt werden konnte. Auf dieser Seite des Zentrums befanden sich auch die Kulissen für das Rettungsboot und die Brücke. Auf der anderen Seite des Geländes wurden zwei Statuen und ein Kiosk gebaut sowie die Kirche, in der der letzte Kampf zwischen den Avengers und Ultron stattfand.","51.59292396582391","-0.24021191534307765","Novi Grad Square, Sokovia","null","null",01:45:00,2015,"Steve Rogers als Captain America",,"https://mculocationscout.com/2020/08/09/novi-grad-square-sokovia-mcu-location-scout/",
"Age of Ultron","A2-45","Hawkeye und Scarlet bekämpfen Droiden an einer Kreuzung.","Piazza Renè Di Challant, 1, 11029 Verrès AO, Italy","Die Kreuzung befindet sich an der Via Martorey und Via Caduti per la Libertà in Verrès, Italien.","45.66869493638452","7.691624236803254","Sokovia","null","null",01:45:36,2015,"Clint Barton als Hawkeye / Wanda Maximoff als Scarlet Witch",,"https://mculocationscout.com/2020/08/09/battle-of-sokovia-italy-mcu-location-scout/",
"Age of Ultron","A2-46","Der finale Kampf zwischen Ultrons Armee und den Avengers.","Lismore Blv, London, United Kingdom","Gedreht wurde im Metropolitan Police Training Centre am Lismore Blv. Auf einer Seite des Ausbildungszentrums stand eine Statue von Sir Robert Peele, die nicht bewegt werden konnte. Auf dieser Seite des Zentrums befanden sich auch die Kulissen für das Rettungsboot und die Brücke. Auf der anderen Seite des Geländes wurden zwei Statuen und ein Kiosk gebaut sowie die Kirche, in der der letzte Kampf zwischen den Avengers und Ultron stattfand.","51.59292396582391","-0.24021191534307765","Novi Grad Square, Sokovia","null","null",01:48:00,2015,"Clint Barton als Hawkeye / Wanda Maximoff als Scarlet Witch / Thor /Steve Rogers als Captain America / Ultron",,"https://mculocationscout.com/2020/08/09/novi-grad-square-sokovia-mcu-location-scout/",
"Age of Ultron","A2-47","Die Zivilisten werden von SHIELD-Rettungsbooten gerettet.","Lismore Blv, London, United Kingdom","Gedreht wurde im Metropolitan Police Training Centre am Lismore Blv. Auf einer Seite des Ausbildungszentrums stand eine Statue von Sir Robert Peele, die nicht bewegt werden konnte. Auf dieser Seite des Zentrums befanden sich auch die Kulissen für das Rettungsboot und die Brücke. Auf der anderen Seite des Geländes wurden zwei Statuen und ein Kiosk gebaut sowie die Kirche, in der der letzte Kampf zwischen den Avengers und Ultron stattfand.","51.59292396582391","-0.24021191534307765","Novi Grad Square, Sokovia","null","null",01:51:52,2015,"Pietro Maximoff als Quicksilver / Natascha Romanow als Black Widow / Steve Rogers als Captain America",,"https://mculocationscout.com/2020/08/09/novi-grad-square-sokovia-mcu-location-scout/",
"Age of Ultron","A2-48","Die Avengers kämpfen mit Ultrons Armee in der Kirche.","Shepperton Studios, Studios Road, Shepperton, Surrey, England, UK","Es ist anzunehmen, dass es sich hierbei um Studioaufnahmen handelt.","51.40797670356879","-0.46609220136945423","Sokovia","null","null",01:56:10,2015,"Wanda Maximoff als Scarlet Witch / Thor /Steve Rogers als Captain America / The Bruce Banner als Hulk / Pietro Maximoff als Quicksilver /",,,
"Age of Ultron","A2-49","Black Widow versucht Hulk zu beruhigen, während Hawkeye die Rettungsaktion mitkoordinier.","Lismore Blv, London, United Kingdom","Gedreht wurde im Metropolitan Police Training Centre am Lismore Blv. Auf einer Seite des Ausbildungszentrums stand eine Statue von Sir Robert Peele, die nicht bewegt werden konnte. Auf dieser Seite des Zentrums befanden sich auch die Kulissen für das Rettungsboot und die Brücke. Auf der anderen Seite des Geländes wurden zwei Statuen und ein Kiosk gebaut sowie die Kirche, in der der letzte Kampf zwischen den Avengers und Ultron stattfand.","51.59292396582391","-0.24021191534307765","Novi Grad Square, Sokovia","null","null",01:58:53,2015,"Clint Barton als Hawkeye / Natascha Romanow als Black Widow / Bruce Banner als Hulk",,,
"Age of Ultron","A2-50","Hawkeye rettet einen Jungen und wird selbst von Quicksilver gerettet, der dabei stirbt.","Lismore Blv, London, United Kingdom","Gedreht wurde im Metropolitan Police Training Centre am Lismore Blv. Auf einer Seite des Ausbildungszentrums stand eine Statue von Sir Robert Peele, die nicht bewegt werden konnte. Auf dieser Seite des Zentrums befanden sich auch die Kulissen für das Rettungsboot und die Brücke. Auf der anderen Seite des Geländes wurden zwei Statuen und ein Kiosk gebaut sowie die Kirche, in der der letzte Kampf zwischen den Avengers und Ultron stattfand.","51.59292396582391","-0.24021191534307765","Novi Grad Square, Sokovia","null","null",01:59:55,2015,"Clint Barton als Hawkeye / Pietro Maximoff als Quicksilver",,,
"Age of Ultron","A2-51","Vision trifft auf den geschwächten Ultron und vernichtet ihn.",,"Der Drehort ist unbekannt.",,,"Sokovischer Wald","null","null",02:05:29,2015,"Ultron / Vision",,,
"Age of Ultron","A2-52","Hawkeye kehrt zu seiner Familie zurück.","Stratfield Saye Park Reading RG7 2BZ, United Kingdom","Der Ort, an dem die Scheune und das Haus gebaut wurden, ist der Stratfield Saye Park.","51.35027603799194","-0.9867394866585626","Barton Farm","null","null",02:06:26,2015,"Clint Barton",,"https://mculocationscout.com/2020/08/09/barton-farm-mcu-location-scout/",
"Age of Ultron","A2-53","Tony Stark fährt mit einem Auto zur neuen Avengers-Headbasis.","Sainsbury Centre for Visual Arts, University of East Anglia, Norwich, England NR4 7TU, United Kingdom","Das erste und wichtigste Gebäude für die Einrichtung ist das Sainsbury Centre for Visual Arts an der University of East Anglia in Norwich, UK. Es wurden einige zusätzliche Innenaufnahmen im Sainsbury Centre gedreht, vor allem Thor, Steve und Tony im Gespräch, und die Versammlung der Avengers in der Schlusseinstellung.","52.62051916108792","1.2347317558150142","Avengers-Headbasis, Upstate, New York","43.50239684316703","-75.38157371845853",02:07:00,2015,"Tony Stark / Natascha Romanow als Black Widow / Nick Fury / Steve Rogers als Captain America",,"https://mculocationscout.com/2020/08/09/new-avengers-facility-mcu-location-scout/",
"Age of Ultron","A2-54","In der neuen Avengers-Headbasis werden Falcon, Wanda (Scarlet) und Vision begrüßt.","Royal Victoria Dock, 1 Western Gateway, London E16 1XL, United Kingdom","Die kurzen Innenaufnahmen am Ende von Avengers: Age of Ultron finden in der Londoner ExCel-Halle in London statt.","51.509061487861246","0.02980539113863503","Avengers-Headbasis, Upstate, New York","43.50239684316703","-75.38157371845853",02:11:00,2015,"Natascha Romanow als Black Widow / Steve Rogers als Captain America / Wanda / Vision / Falcon",,"https://mculocationscout.com/2020/08/09/new-avengers-facility-mcu-location-scout/",
"Infinity War","A3-1","Thanos und seine Handlanger befallen das Schiff der Asgardianer, die zum großen Teil getötet werden. Hulk kämpft gegen Thanos, jedoch erfolglos. Heimdall befördert Hulk auf die Erde. Thanos erhält den Tesserakt und somit den Raum Infinity Stein. Loki und Heimdall werden getötet.","Trilith Studios,
461 Sandy Creek Road
Fayetteville, Georgia 30214","Amerikanisches Film- und Fernsehproduktionsstudio südlich von Atlanta in Fayette County, Georgia. Ehemals Pinewood Atlanta Studios.","33.47312809304286","-84.51253281451417","im All auf dem Schiff der Asgardianer; ""22 jump points from Askard""","null","null",00:00:25,2018,"Heimdall/ Ebony Maw/ Loki/ Thanos/ Thor/ Thanos Handlager/ Leichen von Asgard/ Bruce Banner als Hulk","null","null","Keine Gewähr auf Richtigkeit, dass dies in den Trilith Studios gedreht wurde."
"Infinity War","A3-2A","Hulk wird mit dem Bifröst zurück auf die Erde befördert.","Trilith Studios,
461 Sandy Creek Road
Fayetteville, Georgia 30214","Amerikanisches Film- und Fernsehproduktionsstudio südlich von Atlanta in Fayette County, Georgia. Ehemals Pinewood Atlanta Studios.","33.47312809304286","-84.51253281451417","All","null","null",00:10:16,2018,"Bruce Banner als Hulk","null","null","Keine Gewähr auf Richtigkeit, dass dies in den Trilith Studios gedreht wurde."
"Infinity War","A3-2B","Hulk kommt mit dem Bifröst über New York an.","Trilith Studios,
461 Sandy Creek Road
Fayetteville, Georgia 30214","Amerikanisches Film- und Fernsehproduktionsstudio südlich von Atlanta in Fayette County, Georgia. Ehemals Pinewood Atlanta Studios.","33.47312809304286","-84.51253281451417","New York","null","null",00:10:27,2018,"Bruce Banner als Hulk","null","null","Keine Gewähr auf Richtigkeit, dass dies in den Trilith Studios gedreht wurde."
"Infinity War","A3-3","Dr. Strange und Wong unterhalten sich, als Hulk/Banner auf den Treppen des New York Sanctums aufschlägt. Er kündigt an, dass Thanos bald kommt.","Trilith Studios,
461 Sandy Creek Road
Fayetteville, Georgia 30214","Amerikanisches Film- und Fernsehproduktionsstudio südlich von Atlanta in Fayette County, Georgia. Ehemals Pinewood Atlanta Studios.","33.47312809304286","-84.51253281451417","Sanctum Sanctorum, 177A Bleecker Street, New York, NY 10012, United States","40.72911010071466","-74.00061971555814",00:10:35,2018,"Stephen Strange als Dr. Strange/ Wong/ Bruce Banner als Hulk/ Bruce Banner","https://marvelcinematicuniverse.fandom.com/wiki/New_York_Sanctum, https://www.setdecorators.org/?name=AVENGERS-INFINITY-WAR&art=setdecor_awards_detail&SHOW=SetDecor_Film_Avengers_I_W, https://en.wikipedia.org/wiki/Trilith_Studios","Marvel Cinematic Universe Wiki, Setdecor, Wikipedia","""The physical set from the DR STRANGE film was shipped to Georgia from London and rebuilt, reconfigured, repainted."" - Setdecor"
"Infinity War","A3-4","Tony Stark fragt Pepper Potts, ob sie schwanger sei. Sie diskutieren über ihre gemeinsame Zukunft. Dr. Strange und Bruce Banner tauchen auf und suchen Stark auf. Sie bitten ihn um seine Hilfe.","Piedmont Park,
1320 Monroe Dr NE, Atlanta, GA 30306, United States","Park im Nordosten Atlanta.","33.78630070557729","-84.37764637607489","Central Park, New York","40.78241186820291, ","-73.96048447977054",00:11:26,2018,"Tony Stark/ Pepper Potts","https://www.filmtourismus.de/avengers-infinity-war/, https://mculocationscout.com/2020/09/16/central-park-new-york-mcu-location-scout-2/","Filmtourismus, MCU Location Scout","""The actual footage was filmed in Atlanta’s Piedmont Park, looking out over the soccer fields, which were digitally replaced with imagery of the Jackie Onassis Reservoir and the New York skyline."" - MCU Location Scout"
"Infinity War","A3-5A","Wong und Dr. Strange erklären Bruce Banner und Tony Stark die Entstehung der Infinity Steine und ihre Fähigkeiten. Sie erklären Stark auch, welche Gefahr Thanos darstellt. Strange trägt den Zeit Stein. Vision hat den Gedanken Stein. Um ihn zu finden, muss Stark Steve Rogers kontaktieren. ","Trilith Studios,
461 Sandy Creek Road
Fayetteville, Georgia 30214","Amerikanisches Film- und Fernsehproduktionsstudio südlich von Atlanta in Fayette County, Georgia. Ehemals Pinewood Atlanta Studios.","33.47312809304286","-84.51253281451417","Sanctum Sanctorum, 177A Bleecker Street, New York, NY 10012, United States","40.72911010071466","-74.00061971555814",00:13:18,2018,"Tony Stark/ Wong/ Bruce Banner/ Stephen Strange als Dr. Strange","https://marvelcinematicuniverse.fandom.com/wiki/New_York_Sanctum, https://www.setdecorators.org/?name=AVENGERS-INFINITY-WAR&art=setdecor_awards_detail&SHOW=SetDecor_Film_Avengers_I_W, https://en.wikipedia.org/wiki/Trilith_Studios","Marvel Cinematic Universe Wiki, Setdecor, Wikipedia","""The physical set from the DR STRANGE film was shipped to Georgia from London and rebuilt, reconfigured, repainted."" - Setdecor"
"Infinity War","A3-5B","Draußen beginnt mit der Ankunft eines Raumschiffs der Ausnahmezustand. Tony Stark, Dr. Strange, Bruce Banner und Wong verlassen das New York Sanctum, um draußen nach dem Rechten zu sehen.","Trilith Studios,
461 Sandy Creek Road
Fayetteville, Georgia 30214","Amerikanisches Film- und Fernsehproduktionsstudio südlich von Atlanta in Fayette County, Georgia. Ehemals Pinewood Atlanta Studios.","33.47312809304286","-84.51253281451417","Bleecker St, New York, NY 10012, United States","40.7281049092277","-73.99900289179449",00:17:34,2018,"Tony Stark/ Stephen Strange als Dr. Strange/ Wong/ Bruce Banner","https://mculocationscout.com/2020/09/16/sanctum-sanctorum-new-york-mcu-location-scout-2/, https://www.youtube.com/watch?v=V5mS7BHmZJI&t=34s","MCU Location Scout, Youtube","""While the scene appears to show a continuous shot of the characters exiting 177A Bleecker Street in New York and heading up Thompson St, the scene was actually filmed at the Atlanta Pinewood Studios, in Fayetteville, GA. "" - MCU Location Scout"
"Infinity War","A3-6A","Peter Parker wird auf das Raumschiff aufmerksam und macht sich als Spiderman auf den Weg dahin.","Trilith Studios,
461 Sandy Creek Road
Fayetteville, Georgia 30214","Amerikanisches Film- und Fernsehproduktionsstudio südlich von Atlanta in Fayette County, Georgia. Ehemals Pinewood Atlanta Studios.","33.47312809304286","-84.51253281451417","Ed Koch Queensboro Bridge","40.756788468079115","-73.9542239020659",00:18:14,2018,"Peter Parker/ Peter Parker als Spider-Man","https://mculocationscout.com/2020/09/16/queensboro-bridge-new-york-mcu-location-scout/","MCU Location Scout","Hintergrundbilder wurden auf der Ed Koch Queensboro Bridge gedreht. Keine Gewähr auf Richtigkeit, dass dies in den Trilith Studios gedreht wurde."
,"A3-6B","Peter Parker wird auf das Raumschiff aufmerksam und macht sich als Spiderman auf den Weg dahin.","Ed Koch Queensboro Bridge","null","40.756788468079115","-73.9542239020659","Ed Koch Queensboro Bridge","40.756788468079115","-73.9542239020659",00:18:14,2018,"Peter Parker/ Peter Parker als Spider-Man","https://mculocationscout.com/2020/09/16/queensboro-bridge-new-york-mcu-location-scout/","MCU Location Scout","Hintergrundbild"
"Infinity War","A3-7","Ebony Maw und ein weiterer Außerirdischer kommen aus dem Raumschiff, um sich den Zeitstein von Strange zu holen. Banner schafft es nicht, sich in Hulk zu verwandeln und wird deshalb von Strange durch ein Portal weg vom Geschehen hingebracht.","84 Walton Street NW, Atlanta, GA 30303","null","33.756539179710494","-84.39116951710628","Thompson Street, New York","40.72612172816812","-74.00161128329653",00:18:57,2018,"Tony Stark/ Stephen Strange als Dr. Strange/ Wong/ Bruce Banner/ Ebony Maw/ Cull Obsidian/ Tony Stark als Iron Man","https://www.imdb.com/title/tt4154756/locations, https://mculocationscout.com/2020/09/16/thompson-street-new-york-mcu-location-scout/","IMDb, MCU Location Scout","""Walton Street between Forsyth and Cone, in Atlanta, GA, is the location of this destruction."" - MCU Location Scout"
"Infinity War","A3-8A","Bruce Banner fällt durch den von Dr. Strange erzeugten Portal und landet im Washington Square Park.","Woodruff Park, 91 Peachtree St, Atlanta, GA 30303","Park in Downtown Atlanta","33.755199487488284","-84.38862258625718","Washington Square Park,
Washington Square, New York, NY 10012, United States","40.73102199134093","-73.99731054439424",00:21:28,2018,"Bruce Banner","https://mculocationscout.com/2020/09/16/washington-square-park-new-york-mcu-location-scout/","MCU Location Scout","Hintergrundbilder wurden im Washington Square Park gedreht."
,"A3-8B","Bruce Banner fällt durch den von Dr. Strange erzeugten Portal und landet im Washington Square Park.","Washington Square Park,
Washington Square, New York, NY 10012, United States","null","40.73102199134093","-73.99731054439424","Washington Square Park,
Washington Square, New York, NY 10012, United States","40.73102199134093","-73.99731054439424",00:21:28,2018,"Bruce Banner","https://mculocationscout.com/2020/09/16/washington-square-park-new-york-mcu-location-scout/","MCU Location Scout","Hintergrundbild"
"Infinity War","A3-9","Iron Man, Dr. Strange und Wong lassen ein Auto auf Ebony Maw fliegen, welchen er in zwei Teile durchsägt. Iron Man wird mit einem Objekt getroffen, das ihn wegschleudert.","84 Walton Street NW, Atlanta, GA 30303","null","33.756539179710494","-84.39116951710628","Thompson Street, New York","40.72612172816812","-74.00161128329653",00:21:32,2018,"Stephen Strange als Dr. Strange/ Tony Stark als Iron Man/ Wong/ Ebony Maw/ Cull Obsidian","https://www.imdb.com/title/tt4154756/locations, https://mculocationscout.com/2020/09/16/thompson-street-new-york-mcu-location-scout/","IMDb, MCU Location Scout","""Walton Street between Forsyth and Cone, in Atlanta, GA, is the location of this destruction."" - MCU Location Scout"
"Infinity War","A3-10A","Iron Man wird dorthin geschleudert, wo sich Bruce Banner befindet. Cull Obsidian und Iron Man liefern sich ein Gefecht. Banner ringt mit sich, um Hulk herauszubringen. Spider-Man taucht auf und bewahrt Iron Man davor, von Cull Obsidian zerdrückt zu werden. Gemeinsam kämpfen sie weiter.","Woodruff Park, 91 Peachtree St, Atlanta, GA 30303","Park in Downtown Atlanta","33.755199487488284","-84.38862258625718","Washington Square Park,
Washington Square, New York, NY 10012, United States","40.73102199134093","-73.99731054439424",00:21:48,2018,"Tony Stark als Iron Man/ Bruce Banner/ Cull Obsidian/ Peter Parker als Spider-Man","https://mculocationscout.com/2020/09/16/washington-square-park-new-york-mcu-location-scout/","MCU Location Scout","Hintergrundbilder wurden im Washington Square Park gedreht."
,"A3-10B","Iron Man wird dorthin geschleudert, wo sich Bruce Banner befindet. Cull Obsidian und Iron Man liefern sich ein Gefecht. Banner ringt mit sich, um Hulk herauszubringen. Spider-Man taucht auf und bewahrt Iron Man davor, von Cull Obsidian zerdrückt zu werden. Gemeinsam kämpfen sie weiter.","Washington Square Park,
Washington Square, New York, NY 10012, United States",,"40.73102199134093","-73.99731054439424","Washington Square Park,
Washington Square, New York, NY 10012, United States","40.73102199134093","-73.99731054439424",00:21:48,2018,"Tony Stark als Iron Man/ Bruce Banner/ Cull Obsidian/ Peter Parker als Spider-Man","https://mculocationscout.com/2020/09/16/washington-square-park-new-york-mcu-location-scout/","MCU Location Scout","Hintergrundbild"
